{
  "cycleId": "20260922-1936",
  "stance": "neutral",
  "targetWeights": {
    "KRW-BTC": 0.25,
    "KRW-ETH": 0.125
  },
  "rationale": "risk-on 지표 조건 2개(추세 up 3종목 BTC·ETH·XRP · 공포탐욕 78<80)는 충족했으나 첫 조건('강세가 약세 반박을 견딤')이 5종목 중 BTC 하나에서만 성립해 neutral(총노출 45%·종목당 25%). 종목 대조: BTC 는 20d고점比 -1.53%·7d 급등을 양측이 같이 써 상쇄되지만, ETF 약 10억달러 순유입(9번째 최대)과 vsEMA20·vsEMA50 동시 양전 구조에 bear 가 답하지 않아 bull 확신 4 미반박 → 상단 25%. ETH 는 bear 의 vsEMA20 +0.06% 지적이 bull 의 '추세 up' 근거를 직접 깎고 bull 이 답하지 않았다(미반박) — 다만 bear 의 '내 손익 +0.19% 뿐' 은 매몰비용이라 매도 근거로 채택하지 않는다. 남은 bull 근거(vsEMA50 +0.99%·RSI14 53·ATR 0.75%)로 확신 3 → 한도 절반 12.5%(19.98%→축소). XRP 는 bull vsEMA50 +2.80% 와 bear 30d +0.98% 가 서로 미반박으로 맞서 3대3 상쇄 → 0. SOL(bull 2·bear 4)·DOGE(bull 2·bear 5)는 vsEMA20 음수·추세 mixed 를 bull 도 인정 → 0. 리스크 담당 상한(BTC 25·ETH 25·XRP 19.2·SOL 22·DOGE 19.3, 총 45, 현금 55) 전부 준수, 거부권 없음, 이견 없음. Binance 제재 위반 '조사'와 Coldcard 지갑 해킹(52 BTC 회수)은 policy.md 4절 6 경성 목록(거래소 해킹·지급불능·출금중단·거래정지·디페그·거래금지)에 해당 사실 주장이 없어 risk-off 로 보지 않는다.",
  "evidence": [
    "[스냅샷 2절] BTC 추세 up · vsEMA20 +0.34% · vsEMA50 +1.64% · RSI14 57 · 거래대금비 1.73x · 20d고점比 -1.53% — bull 확신 4 의 구조 근거",
    "[스냅샷 4절 CoinDesk 2026-09-22 16:40] 'Spot bitcoin ETFs attracted nearly $1 billion on Monday, the 9th largest inflow ever' — bear 가 답하지 않은 별도 근거 (증거로만 사용)",
    "[스냅샷 2절] ETH vsEMA20 +0.06% — bear 확신 4 의 핵심 지적, bull 이 답하지 않아 채택 (추세 근거가 EMA20 에 겨우 걸림)",
    "[스냅샷 2절] ETH vsEMA50 +0.99% · RSI14 53 · ATR%14 +0.75% · 30d +8.29% — bear 미반박으로 남은 bull 근거, 전량 청산이 아닌 절반 축소의 이유",
    "[스냅샷 1절] ETH 평균단가 3,690,000원 · 현재가 3,697,000원 · 손익 +0.19% — bear 인용이나 매몰비용이라 매도 근거로 채택하지 않음",
    "[스냅샷 2절] XRP vsEMA50 +2.80%(bull 미반박) vs 30d +0.98% · 20d고점比 -3.11% · 일변동성20 3.91%(bear 미반박) — 3대3 상쇄 → 0",
    "[스냅샷 2절] SOL vsEMA20 -0.26% · 추세 mixed · 전일 -2.24%, DOGE vsEMA20 -1.00% · 4h -2.96% · 20d고점比 -5.07% · ATR%14 2.56% — bull 도 근거 상충 인정 → 0",
    "[스냅샷 3절] 공포탐욕 78 Extreme Greed(7일 51→78) — 80 미만이라 risk-on 지표 조건은 통과, 85 미만이라 risk-off 아님",
    "[스냅샷 2절] 추세 up 3종목(BTC·ETH·XRP) · mixed 2(SOL·DOGE) — policy.md 3절 up 3개 이상 조건 충족",
    "[스냅샷 1절] 총자산 10,033,269원(시작 대비 +0.33%) · 현금 5,529,778원 · BTC 24.91% · ETH 19.98% — 손실 제동 미발동",
    "[risk-officer 20260922-1936] neutral 상한 BTC 25% · ETH 25% · XRP 19.2% · SOL 22% · DOGE 19.3% · 총노출 45% · 현금 55% · 거부권 없음",
    "[스냅샷 5절] 09-21 무효화 조건 전부 미충족 — ETH vsEMA50 +0.99%(양수)·RSI14 53(<80) · BTC vsEMA50 +1.64%·20d고점比 -1.53%(>-5%) · 24h 둘 다 양수 · 추세 up 3(>2) · XRP·SOL 20d 고점 미갱신"
  ],
  "confidence": 0.55,
  "horizonHours": 24,
  "invalidation": "다음 회차에 (1) BTC vsEMA50 음수 또는 20d고점比 ≤ -5% 면 ETF·EMA 구조 논지 폐기 → BTC 0 으로 재논증, (2) ETH vsEMA50 음수면 남은 12.5% 도 0, (3) ETH vsEMA20 ≥ +1.5% 회복 유지면 이번 절반 축소가 과했던 것으로 기록, (4) BTC·ETH 중 하나라도 24h ≤ -4% 면 즉시 축소, (5) 추세 up ≤ 2 또는 공포탐욕 ≥ 85 면 자세 재산정, (6) Binance 가 기소·출금중단·거래정지로 확정되면 전체 risk-off.",
  "memoryNote": "neutral. 추세 up 3·공포탐욕 78 로 risk-on 지표 조건은 충족했으나 견디는 종목이 BTC 하나뿐이라 neutral 유지 → 총노출 44.9%→37.5%. BTC 25% 유지(ETF 약 10억달러 순유입·vsEMA50 +1.64% 미반박 · 밴드 안이라 주문 없음), ETH 19.98%→12.5% 절반 축소(bear 의 vsEMA20 +0.06% 미반박, 단 '평균단가 대비 손익 +0.19%' 는 매몰비용이라 기각), XRP 3대3 상쇄·SOL·DOGE bear 우세로 0. 09-21 무효화 조건 6개 모두 미충족.",
  "lessonCandidate": "bear 의 '내 평균단가 대비 손익이 낮다'(ETH +0.19%)는 매몰비용이라 매도 근거가 아니다 — 미래 분포에 대한 정보가 없으므로 의장이 기각한다. 반면 같은 bear 의 vsEMA20 +0.06% 는 bull 이 세운 '추세 up' 의 근거를 직접 깎으므로 미반박 채택 대상이다. 논지의 출처가 같은 역할이어도 하나는 기각·하나는 채택될 수 있다 — 채택 단위는 역할이 아니라 논지 하나하나다."
}
