{
  "cycleId": "20260921-1910",
  "stance": "neutral",
  "targetWeights": {
    "KRW-BTC": 0,
    "KRW-ETH": 0.11,
    "KRW-XRP": 0.0683,
    "KRW-SOL": 0.0759,
    "KRW-DOGE": 0.1
  },
  "rationale": "검산표 5개 항목 전부 통과 → 제안을 줄이지 않는다. 다만 밴드(3%) 안의 드리프트는 손대지 않는다는 규칙대로 ETH(제안 13.8 vs 현재 11.00 · 2.80%p) XRP(8.3 vs 6.83 · 1.47%p) SOL(9.4 vs 7.59 · 1.81%p)은 현재 비중을 그대로 적는다. 밴드 밖인 두 종목만 움직인다: BTC 는 RSI14 81 ≥ 80 으로 코어에서 빠져 제안 0% (현재 16.63% · 차이 16.63%p) 전량 매도 예정이고, 매도액 1,681,393원은 최소 거래 100,000원 위라 밴드·최소 주문액에 걸리지 않는다. DOGE 는 미보유(0%)에서 제안 10.0% 로 신규 편입 매수. 결과 총노출 35.4% · 현금 64.6% 로 제안(41.5%)보다 낮고, 모든 종목이 제안 이하다. 주문 2건 · 회전율 26.6% 로 상한 안.",
  "evidence": [
    "signals.md 제안: ETH +13.8% · XRP +8.3% · SOL +9.4% · DOGE +10.0% · BTC 0% (RSI 81 ≥ 80 과열) → 코인 41.5% · 현금 58.5%",
    "snapshot 2절(기준 2026-09-21 19:10 KST): RSI14 BTC 81 · ETH 69 · XRP 73 · SOL 73 · DOGE 68, 추세 5종목 모두 up, 거래대금비 1.53/1.55/0.94/1.32/1.89 전부 ≥ 0.5 — 제안 판정과 일치",
    "snapshot 2절 일변동성20: ETH +2.18% < DOGE +3.00% < SOL +3.19% < XRP +3.62% — 제안 비중 순서(13.8 > 10.0 > 9.4 > 8.3)의 정확한 역순",
    "재계산: 1/변동성 가중 → ETH 33.2% · DOGE 24.1% · SOL 22.7% · XRP 20.0%, 가중평균 일변동성 +2.89%, 총노출 1.20 ÷ 2.89 = 41.5% — 계산 메모와 일치",
    "snapshot 3절 공포탐욕 70 (< 80) · 1절 시작 대비 +1.11% (> −2%) → policy 2-4 축소 배율 없음, 제안에도 배율 없음",
    "급등 편입 검산: 신규 편입은 DOGE 뿐(1절 보유 없음). 24h +6.84% < 일변동성 3.00% × 3 = 9.00% → 절반 축소 대상 아님",
    "snapshot 1절 장부: 현금 5,859,381원 + 평가액 4,251,720원 = 10,111,101원 vs 총자산 10,111,100원 (반올림 1원) · 종목 평가액 합 1,681,393+1,112,306+690,408+767,613 = 4,251,720원 일치",
    "snapshot 1절 현재 비중: BTC 16.63% · ETH 11.00% · XRP 6.83% · SOL 7.59% · DOGE 0% · 현금 57.95%",
    "snapshot 4절 뉴스 48시간: 해킹·거래 정지·디페그·거래 금지 규제 제목 없음 (ETF 유입·SEC 토큰화 주식 면제 등) → 경성 위험 축소 없음",
    "policy.json 상한 대비: 총노출 35.4% ≤ 60% · 현금 64.6% ≥ 40% · 주문 2건 ≤ 4건 · 회전율 (1,681,393+1,011,110)/10,111,100 = 26.6% ≤ 50%"
  ],
  "confidence": 0.72,
  "horizonHours": 24,
  "invalidation": "다음 회차에 ETH 또는 DOGE 의 1시간봉 추세가 down 으로 바뀌거나, 둘 중 하나의 RSI14 가 80 이상이 되어 코어에서 빠지거나, 공포탐욕 지수가 80 이상이 되어 총노출 배율 ×0.7 이 걸리거나, 시작 대비 수익률이 −2% 이하로 내려가 손실 사다리 ×0.6 이 걸리면 이 비중은 무효다.",
  "memoryNote": "검산 5/5 통과 · 제안(41.5%)을 그대로 쓰되 밴드 안인 ETH·XRP·SOL 은 현재 비중 유지 → 실제 총노출 35.4% · 현금 64.6%. 주문은 BTC 전량 매도(RSI 81 과열 탈락) + DOGE 신규 매수 2건.",
  "lessonCandidate": "밴드 유지와 종목 탈락이 겹친 회차는 실제 총노출이 제안보다 크게 낮아진다(41.5% → 35.4%). 최대 비중 종목이 RSI 과열로 빠지면 그 자리는 현금으로 남고 나머지는 밴드에 묶여 안 늘기 때문이다. 다음 리그 규칙 제안으로 '코어 탈락으로 생긴 공백은 밴드 판정을 한 회차 면제' 를 남긴다."
}
