{
  "cycleId": "20260921-1910",
  "stance": "neutral",
  "targetWeights": {
    "KRW-BTC": 0.24,
    "KRW-ETH": 0.2
  },
  "rationale": "추세 up 5종목·공포탐욕 70(<80)으로 risk-on 의 지표 조건 2개는 충족했으나, 첫 조건('강세 논지가 약세 반박을 견딤')이 책 전체에서 깨졌다 — XRP·SOL 은 양측이 같은 숫자(XRP 거래대금비 0.94x·30d -4.31% / SOL 30d +19.77%·20d고점比 +0.13%)를 반대로 읽은 순수 상쇄라 어느 쪽 근거도 아니고, BTC 는 bull 4 대 bear 4 로 팽팽하다. policy.md 3절 '논지가 팽팽하면 neutral' 을 적용한다. 종목별: BTC 는 ETF 유입 논지가 미반박(bear 가 반박 근거 없음을 자인)이지만 RSI 81 고점추격 논지도 미반박이라 상단 대신 현 보유 유지(24.72%→24%, 밴드 5% 안이라 주문 없음). ETH 만 bull 확신 4 가 살아남았다 — bear 의 유일한 반박이 bull 과 같은 거래대금비 1.55x 를 인용해 상쇄됐고 RSI 69 최저·30d +9.11% 최고는 건드려지지 않았으며 bear 스스로 확신 2 다. XRP·SOL 은 상쇄로 0, DOGE 는 bull 확신 2(=결정규칙 2 에 따라 0)에 bear 확신 5 다. 리스크 담당 상한(neutral BTC 25%·ETH 25%·총 45%) 이내이며 이견 없다. 거부권 없음, 경성 위험 뉴스 없음.",
  "evidence": [
    "스냅샷 2절: BTC 추세 up · vsEMA20 +2.50% · vsEMA50 +3.33% · 7d +8.44% · 거래대금비 1.53x (bull 확신 4, 미반박)",
    "스냅샷 4절 Moomoo 2026-09-21 15:57 'Bitcoin Stays Stronger on ETF Inflows, Regulatory Progress' + 15:39 'ETF Flows Turn Positive in a Volatile Week' — bear 가 '반박 근거를 갖지 못한다'고 자인",
    "스냅샷 2절: BTC RSI14 81(5종 최고) · 20d고점比 +1.96% — bear 의 고점추격 논지, bull 이 반박하지 않음(무효화 조건으로만 언급). BTC 상단 포기 근거",
    "스냅샷 2절: ETH RSI14 69(5종 최저) · 30d +9.11%(최고) · 7d +8.63% · vsEMA50 +2.79% — bear 표에서 반대 논증 없음",
    "스냅샷 3절: ETH 펀딩비 0.0087% < BTC 0.0100% — 롱 비용이 BTC 보다 낮음, 미반박",
    "상쇄 판정(ETH): bull '거래대금비 1.55x 유입' vs bear '1.55x 유입 대비 20d고점比 +1.46% 뿐' — 같은 숫자라 어느 쪽 근거도 아님. bear 자체 확신 2",
    "상쇄 판정(XRP): bull '거래대금비 0.94x = 과열 자금 없음' vs bear '0.94x = 돈이 안 붙음' · 양측 모두 30d -4.31% 인용. 남은 미반박은 bear 의 일변동성20 +3.62%(5종 최고) → XRP 0",
    "상쇄 판정(SOL): bull '7d +13.37%·30d +19.77%·20d고점比 +0.13% = 모멘텀 1위' vs bear '같은 수치 = 되돌림 여지 최대'. 양측 모두 상대가 안 건드린 별도 근거 없음 → SOL 0",
    "스냅샷 2절: DOGE 30d -2.34% · 20d고점比 -3.85% · ATR%14 +1.75%(최고) · 거래대금비 1.89x(최고) — bear 확신 5, bull 확신 2 → 결정규칙 2 에 따라 0",
    "스냅샷 3절: 공포탐욕 70 Greed(risk-on 문턱 80·risk-off 문턱 85 모두 미달) · 7일 경로 50→51→69→70 · 김프 BTC -1.27%",
    "스냅샷 1절: 총자산 10,003,492원(시작 대비 +0.03%) · 현금 75.28% · KRW-BTC 24.72%(+2.90%) — 손실 제동 미발동",
    "risk-officer 상한(neutral): BTC 25.0% · ETH 25.0% · XRP 20.7% · SOL 23.5% · DOGE 25.0% · 총노출 45% · 거부권 없음 · 경성 위험 뉴스 0건"
  ],
  "confidence": 0.52,
  "horizonHours": 24,
  "invalidation": "다음 회차에 (1) ETH vsEMA50 음수 또는 ETH RSI14 ≥ 80 이면 'RSI 최저+30d 최고' 논지 폐기 → ETH 재논증, (2) BTC vsEMA50 음수 또는 BTC 20d고점比 ≤ -5% 이면 BTC 0 으로 재논증, (3) BTC·ETH 중 하나라도 24h ≤ -4% 이면 즉시 축소, (4) 추세 up 종목 ≤ 2 또는 공포탐욕 ≥ 85 면 자세 재산정, (5) SOL·XRP 가 거래대금비 ≥ 1.2x 로 20d 고점을 넘겨 유지하면 이번 0 이 틀린 것으로 기록.",
  "memoryNote": "neutral. 추세 up 5종목이지만 XRP·SOL 이 순수 상쇄, BTC 4대4 팽팽이라 risk-on 첫 조건 불충족 → 총노출 24.7%→44%. BTC 24% 유지(주문 없음·밴드 안), ETH 20% 신규(bull 확신 4 미반박·bear 확신 2), XRP·SOL·DOGE 0. 지난 회차 무효화 조건 (3) 충족 — SOL 이 vsEMA20 +2.72%·vsEMA50 +3.84% 동시 양전에 거래대금비 1.32x 유지 → 09-20 SOL 전량 청산은 틀린 매도로 기록한다.",
  "lessonCandidate": "지표 조건(추세 up 개수·공포탐욕)만 충족해도 자세는 올라가지 않는다. risk-on 의 첫 조건은 '강세 논지가 약세 반박을 견딤'이고, 종목 대부분이 상쇄면 시장이 아무리 좋아 보여도 neutral 이다. 또 무효화 조건이 '내 과거 결정이 틀렸다'로 충족된 것(SOL)은 그 종목을 되사라는 신호가 아니라 이번 회차 토론을 백지에서 다시 하라는 신호다 — 이번엔 상쇄라 0 을 유지했다."
}
