{
  "cycleId": "20260920-1910",
  "stance": "neutral",
  "targetWeights": {
    "KRW-BTC": 0.24
  },
  "rationale": "자세: 추세 up 종목이 0개(mixed 4·down 1)라 policy.md 3절 risk-on 조건(up 3개 이상)이 깨졌고, 경성 위험 뉴스 없음·공포탐욕 71(<85)·시작 대비 -0.91%(>-3%)라 risk-off 조건도 아니다 → neutral(총노출 45%·종목당 25%). BTC: bear 가 vsEMA20 -0.14%·거래대금비 0.91x 로 단기 동력은 꺾었지만, '5종목 중 유일하게 EMA50 위(+0.28%)이고 20d고점 이격이 -1.96% 로 가장 얕다'는 상대강도 논지에는 답하지 않았다. 8만달러 뉴스는 bull·bear 가 같은 사건을 양쪽에서 인용해 상쇄. 확신 3~4 → 상단이 아닌 24%(neutral 상한 25% 이하, 밴드 5%p 밖이라 실제 축소 주문이 나간다). SOL: 지난 회차 무효화 조건 (2) 'SOL vsEMA50 음수'가 -0.79% 로 충족돼 기존 논지를 폐기하고 재논증했으나, bull 의 대체 논지(30d/7d 최고·거래대금 1.23x)는 bear 의 '가장 많이 오른 종목이 가장 많이 빠지며 EMA20·50 동시 이탈, 그 거래대금이 차익 물량' 반박에 답하지 못했고 Yahoo 로테이션 기사는 양쪽이 같이 인용해 상쇄 → 0. ETH·XRP·DOGE: bear 의 거래대금비 0.86x/0.82x·30d 단독 마이너스·추세 down 지적이 미반박 → 신규 편입 없음. 리스크 담당 상한(BTC 25%)에 이견 없고 그대로 따른다.",
  "evidence": [
    "[스냅샷 2절] BTC vsEMA50 +0.28% — 5종목 중 유일한 EMA50 상단 (ETH -0.34% · XRP -0.46% · SOL -0.79% · DOGE -1.92%)",
    "[스냅샷 2절] BTC 20d고점比 -1.96% — 5종목 중 가장 얕은 이격 (ETH -3.00% · XRP -6.38% · SOL -5.42% · DOGE -10.77%)",
    "[스냅샷 2절] BTC 7d +5.43% · 30d +4.37% · RSI14 47 · 24h -0.90%",
    "[스냅샷 2절] 추세 = BTC/ETH/XRP/SOL mixed · DOGE down → 1h 기준 up 종목 0개 (policy.md 3절 risk-on 조건 미충족)",
    "[스냅샷 2절] SOL vsEMA20 -1.05% · vsEMA50 -0.79% · 24h -3.07% · 일변동성20 +3.27% — 지난 회차 무효화 조건 (2) 충족",
    "[스냅샷 5절 20260919-1910] 무효화 조건: '(2) SOL vsEMA50 이 음수 … 충족되면 해당 논지를 폐기하고 그 종목을 다시 논증한다'",
    "[스냅샷 2절] SOL 30d +15.33% · 7d +9.62% · 거래대금비 1.23x (bull 논지) ↔ 전일대비 -2.18% · 24h -3.07% (bear 반박)",
    "[스냅샷 4절 Yahoo Finance 2026-09-20 10:45] 'Solana Rose 10% and Bitcoin 5%: Is the Rotation Into Altcoins Starting?' — bull·bear 가 같이 인용 → 상쇄",
    "[스냅샷 4절 코인리더스 2026-09-20 13:27] '비트코인 8만달러 위태롭다…8만2,000달러 벽 막히자 거래량 45% 급감' ↔ [Investing.com 14:06] 'ETF 자금 유입 재개로 8만 달러 선 유지' → 상쇄",
    "[스냅샷 2절] ETH 거래대금비 0.86x · XRP 0.82x — bear 의 수급 이탈 논지, bull 미반박",
    "[스냅샷 2절] XRP 30d -5.49% · DOGE 30d -7.94% · DOGE 추세 down · RSI14 32",
    "[스냅샷 3절] 공포·탐욕 71 Greed (<85) · BTC 펀딩비 +0.0100% · 김치 프리미엄 BTC -1.17% · [1절] 총자산 9,908,521원 (-0.91%, 손실 제동 미발동)"
  ],
  "confidence": 0.55,
  "horizonHours": 24,
  "invalidation": "다음 회차에 (1) BTC vsEMA50 이 음수이거나 BTC 20d고점比 ≤ -5% 이면 상대강도 논지 폐기 → BTC 0 으로 재논증. (2) BTC 24h ≤ -4% 이면 즉시 축소. (3) SOL 이 vsEMA20·vsEMA50 동시 양전하고 거래대금비 ≥ 1.2x 유지면 이번 전량 매도가 틀린 것으로 기록. (4) 추세 up 3종목 이상 또는 공포탐욕 ≥ 85 면 자세 재산정.",
  "memoryNote": "neutral. 추세 up 0개라 risk-on 조건 소멸 → 총노출 47.5%→24%. BTC 만 24% 유지(EMA50 위·20d고점 이격 -1.96% 상대강도 미반박), SOL 은 지난 회차 무효화 조건(vsEMA50 음수) 충족 + 대체 논지가 반박당해 전량 청산. ETH·XRP·DOGE 는 bear 의 거래대금비·30d 지적이 미반박이라 0.",
  "lessonCandidate": "내가 쓴 무효화 조건이 충족되면 '재논증'은 원위치 유지가 아니라 백지에서 다시 세우는 것이다. 이번 SOL 처럼 대체 논지가 반박당하면 보유 이유가 남지 않으므로 0 이 기본값이다."
}
