{
  "cycleId": "20260920-1910",
  "stance": "neutral",
  "targetWeights": {
    "KRW-BTC": 0.163,
    "KRW-ETH": 0.1072,
    "KRW-XRP": 0.066,
    "KRW-SOL": 0.0731
  },
  "rationale": "검산표 5개 항목 전부 통과 → 제안을 줄이지 않는다. 다만 밴드(3%) 안의 드리프트는 손대지 않는다는 규칙대로, 제안과 현재 비중의 차이가 3% 미만인 ETH(13.3 vs 10.72 · 2.58%p) XRP(8.3 vs 6.60 · 1.70%p) SOL(9.2 vs 7.31 · 1.89%p) 은 현재 비중을 그대로 적고, 차이가 3.23%p 로 밴드를 벗어난 BTC 만 제안치 16.3% 로 올린다(매수 약 32만원 · 최소 주문액 10만원 통과). DOGE 는 1h 추세 down 으로 제안에서 빠졌는데 지난 회차 매수가 주문 상한에 걸려 거절됐던 터라 보유 수량이 없다 — 매도할 것이 없어 주문도 없다. 뉴스 제목에 해킹·거래정지·디페그·거래금지 규제 없음. 결과 총노출 40.9% · 현금 59.1%.",
  "evidence": [
    "편입 판정(스냅샷 2절, 19:10 KST): BTC mixed/RSI47/거래대금비 0.91x, ETH mixed/39/0.86x, XRP mixed/42/0.82x, SOL mixed/39/1.23x — 모두 down 아님·RSI<80·비율≥0.5 로 제안의 '적격'과 일치. DOGE 는 down(116원 < EMA20 < EMA50)이라 0% 제안이 맞다.",
    "변동성 가중(2절): 일변동성 BTC 1.84% < ETH 2.25% < SOL 3.27% < XRP 3.60%, 제안 비중 16.3 > 13.3 > 9.2 > 8.3 으로 역순 일치. 1/변동성 정규화 재계산치 16.3/13.3/9.2/8.3 과 제안이 소수점까지 같다.",
    "총노출(제안 메모 + 3절): 1.20% ÷ 가중평균 2.55% = 47.1% ≤ 상한 60%, 현금 52.9% ≥ 40%. 공포탐욕 71(3절)은 80 미만이라 ×0.7 배율 없음, 시작 대비 -0.81%(1절)는 -2% 초과라 손실 사다리 없음 — 메모에 배율이 없는 것이 맞다.",
    "급등 편입(2절): 이번에 새로 편입되는 종목 없음(BTC/ETH/XRP/SOL 모두 기보유). 24h 수익률도 전부 음수(-0.90 ~ -3.07%)라 일변동성×3 초과 종목 없음.",
    "신선도·장부(1·2절): 지표 기준 시각 2026-09-20 19:10 KST = 회차 기준 시각과 동일(0시간). 현금 6,180,000원 + 코인 평가액 3,739,160원 = 총자산 9,919,160원 으로 일치.",
    "밴드 판정(1절 비중 vs 제안): BTC 13.07→16.3(+3.23%p, 밴드 밖) · ETH 10.72→13.3(+2.58%p) · XRP 6.60→8.3(+1.70%p) · SOL 7.31→9.2(+1.89%p, 셋 다 밴드 안).",
    "뉴스(4절, 기준 시각 이전 48h): 거래소 해킹·출금 중단·업비트 거래 정지·스테이블코인 디페그·거래 금지 규제 제목 없음. 'SEC·CFTC 움직였다'(09-20 11:13) 등은 규제 진전 쪽 제목이다.",
    "보유 중 제안에서 빠진 종목: DOGE(제안 0%). 1절 보유 표에 DOGE 행이 없다(지난 회차 매수 거절) → 매도 주문 불필요."
  ],
  "confidence": 0.72,
  "horizonHours": 24,
  "invalidation": "다음 회차에 BTC 또는 ETH 의 1시간봉 추세가 down 으로 바뀌거나, 공포탐욕 지수가 80 이상이 되어 총노출 배율 ×0.7 이 걸리거나, 시작 대비 수익률이 -2% 이하로 내려가 손실 사다리 ×0.6 이 걸리면 이 비중은 무효다.",
  "memoryNote": "검산 5/5 통과 · 제안(총노출 47.1%)을 그대로 쓰되 밴드 안인 ETH·XRP·SOL 은 현재 비중 유지 → 실제 총노출 40.9% · 현금 59.1% · 주문은 BTC 매수 1건.",
  "lessonCandidate": "지난 회차 주문 상한으로 거절된 DOGE 는 이번 회차에 추세 down 으로 제안에서 빠져, 못 채운 칸이 저절로 닫혔다. 거절된 주문을 다음 회차에 억지로 메우지 말고 그 회차의 제안을 다시 받는 것이 맞다."
}
