{
  "cycleId": "20260922-1942",
  "stance": "neutral",
  "targetWeights": {
    "KRW-BTC": 0.112,
    "KRW-ETH": 0.106,
    "KRW-XRP": 0.061,
    "KRW-SOL": 0.071,
    "KRW-DOGE": 0.062
  },
  "rationale": "검산표 5개 항목 전부 통과 → 제안 목표 비중을 그대로 옮긴다(총노출 41.2%). 경성 위험 뉴스 없음. 이번 회차는 밴드 안 종목의 현재 비중이 제안보다 높은 첫 사례다 — ETH 10.94% XRP 7.00% SOL 7.57% 는 제안(10.6/6.1/7.1)과의 차이가 각각 0.34/0.90/0.47%p 로 밴드 3% 안이라 손대지 않는 것이 맞지만, '현재 비중을 그대로 적는' 처리는 제안보다 큰 값이 되어 상한 규칙을 어긴다. 그래서 제안 값을 적는다 — 밴드 판정은 실행 코드가 하므로 주문은 어차피 생기지 않고 결과는 같다. 보유 4종목 모두 제안에 남아 전량 매도 대상은 없다. 실제로 움직이는 것은 두 칸뿐이다: 어제 RSI 과열로 비운 BTC 를 11.2% 로 다시 채우고(신규 편입 검산 통과), 밴드를 4.27%p 벗어난 DOGE 를 10.47% → 6.2% 로 줄인다. 두 주문 모두 최소 거래액 10만원을 넘고 회전율은 약 15.5% 로 상한 50% 안이다.",
  "evidence": [
    "편입 판정: 추세 down 없음(BTC·ETH·XRP·SOL up · DOGE mixed) · RSI14 58/54/60/53/52 모두 80 미만 · 거래대금비 1.71/1.46/1.57/1.53/3.39 모두 0.5 이상 — 스냅샷 2절(기준 2026-09-22 19:42:34 KST)",
    "변동성 가중: 제안 비중 내림차순 BTC 11.2 > ETH 10.6 > SOL 7.1 > DOGE 6.2 > XRP 6.1 이 일변동성20 오름차순 2.14 < 2.27 < 3.39 < 3.86 < 3.90 과 정확히 역순 — 뒤집힘 없음(signals.md 표)",
    "총노출 재계산: 1÷일변동성 합 1.7183(BTC .4673 ETH .4405 SOL .2950 DOGE .2591 XRP .2564) → 가중평균 일변동성 2.91% → 1.20% ÷ 2.91% = 41.2%. 상한 60% 이하 · 현금 58.8% 로 하한 40% 이상 (signals.md 계산 메모와 일치)",
    "배율 확인: 공포탐욕 78 < 80 이므로 총노출 ×0.7 미적용 · 시작 대비 +2.00% 로 −2% 위이므로 손실 사다리 미적용 — 계산 메모에 배율이 없는 것과 일치 (스냅샷 1절·3절)",
    "급등 편입: 신규 편입은 BTC 하나(1절 보유 목록에 없음) · 24h +1.47% < 일변동성 2.14% × 3 = 6.42% → 절반 감축 불필요. 보유 중인 DOGE 는 신규 편입 아님(참고로 +5.60% < 11.58%)",
    "신선도: 2절 지표 기준 시각 2026-09-22 19:42:34 = 회차 기준 시각, 3시간 안 (스냅샷 머리말)",
    "장부: 현금 6,529,664원 + 코인 평가액 3,669,902원 = 10,199,566원 vs 총자산 10,199,565원 — 1원 반올림 차이. 개별 평가액 합(1,116,225+713,929+772,016+1,067,732)도 3,669,902원으로 일치",
    "보조 확인: 보유 4종목(ETH 10.94% · XRP 7.00% · SOL 7.57% · DOGE 10.47%) 전부 제안 목록에 남아 있어 코어 탈락에 의한 전량 매도는 없다 (스냅샷 1절)",
    "밴드(3%) 판정: ETH 0.34%p · XRP 0.90%p · SOL 0.47%p 는 밴드 안 → 주문 없음. DOGE 4.27%p · BTC 11.2%p 는 밴드 밖 → 각각 약 435,522원 매도 · 약 1,142,351원 매수, 최소 거래 100,000원 이상",
    "뉴스 4절: 'Binance probed by U.S. federal prosecutors for sanctions violations'(CoinDesk 19:07) · 'White hats outrun Coldcard hackers in 52-Bitcoin evacuation'(Cointelegraph 18:06) — 업비트 거래 정지·거래소 지급불능·스테이블코인 디페그·거래 금지 규제 어디에도 해당하지 않아 경성 위험 0 처리 없음"
  ],
  "confidence": 0.62,
  "horizonHours": 24,
  "invalidation": "다음 회차에 BTC 또는 DOGE 의 1시간봉 추세가 down 으로 바뀌거나, 어느 종목이든 RSI14 가 80 이상이 되어 코어에서 빠지거나, 공포탐욕 지수가 80 이상이 되어 총노출 배율 ×0.7 이 걸리거나, 시작 대비 수익률이 −2% 이하로 내려가 손실 사다리 ×0.6 이 걸리면 이 비중은 무효다.",
  "memoryNote": "검산 5/5 통과 · 제안 총노출 41.2% 를 그대로 채택(공포탐욕 78 로 ×0.7 문턱 2 아래) · 밴드 안인 ETH·XRP·SOL 은 주문 없이 유지되어 실제 노출 약 42.9% · 움직이는 칸은 BTC 재편입 11.2% 와 DOGE 10.47%→6.2% 두 건.",
  "lessonCandidate": "밴드 안 종목의 현재 비중이 제안보다 높을 때 '밴드 안이면 현재 비중 유지' 와 '제안 이하' 가 충돌한다. 이번엔 제안 값을 적어 상한을 지켰고, 밴드 판정은 실행 코드가 하므로 주문은 생기지 않아 결과가 같았다. 다음 리그 규칙 제안으로 '밴드 유지는 현재 비중과 제안 중 작은 값으로 적는다' 를 남긴다."
}
